{"type":"config","name":"memory search speed (p50)","metricName":"search_p50_ms","metricUnit":"ms","bestDirection":"lower"}
{"run": 1, "commit": "986e062", "metric": 0.0102, "metrics": {"search_p99_ms": 0.3406, "q0_p50_ms": 0.013, "q0_p99_ms": 0.0242, "q1_p50_ms": 0.0059, "q1_p99_ms": 0.1717, "q2_p50_ms": 0.0047, "q2_p99_ms": 0.0051, "q3_p50_ms": 0.0061, "q3_p99_ms": 0.0171, "q4_p50_ms": 0.0105, "q4_p99_ms": 0.1705, "q5_p50_ms": 0.0132, "q5_p99_ms": 0.3972, "assert_ok": 1}, "status": "keep", "description": "baseline: recall result memo + candidate cache already in tree; asserts pass", "segment": 0, "timestamp": 1790150456}
{"run": 2, "commit": "45fadba", "metric": 0.0119, "metrics": {"search_p99_ms": 0.7114, "q0_p50_ms": 0.0148, "q0_p99_ms": 0.0353, "q1_p50_ms": 0.0114, "q1_p99_ms": 0.4673, "q2_p50_ms": 0.0082, "q2_p99_ms": 0.0107, "q3_p50_ms": 0.0072, "q3_p99_ms": 0.0141, "q4_p50_ms": 0.0121, "q4_p99_ms": 0.5665, "q5_p50_ms": 0.0211, "q5_p99_ms": 0.719, "assert_ok": 1}, "status": "discard", "description": "Counter.update(ids) for pending access counts (batched, C-speed) — slower than baseline (0.0119 vs 0.0102); p99 also doubled, suspect machine noise; reverted", "segment": 0, "timestamp": 1790150604}
{"run": 3, "commit": "b676969", "metric": 0.011, "metrics": {"search_p99_ms": 0.6782, "q0_p50_ms": 0.0133, "q0_p99_ms": 0.0245, "q1_p50_ms": 0.0129, "q1_p99_ms": 0.3244, "q2_p50_ms": 0.0051, "q2_p99_ms": 0.0084, "q3_p50_ms": 0.0043, "q3_p99_ms": 0.0086, "q4_p50_ms": 0.0097, "q4_p99_ms": 0.1934, "q5_p50_ms": 0.0243, "q5_p99_ms": 1.0162, "assert_ok": 1}, "status": "discard", "description": "baseline noise probe (unchanged code) — 0.0110 vs 0.0102 best; quantifies single-run noise floor at ±8%+ on p50; reverted nothing", "segment": 0, "timestamp": 1790150683}
{"type": "config", "name": "memory search speed (p50)", "metricName": "search_p50_ms", "metricUnit": "ms", "bestDirection": "lower"}
{"run": 4, "commit": "8c8da91", "metric": 0.0114, "metrics": {"search_p99_ms": 0.8487, "q0_p50_ms": 0.015, "q0_p99_ms": 0.0305, "q1_p50_ms": 0.0112, "q1_p99_ms": 0.6032, "q2_p50_ms": 0.0088, "q2_p99_ms": 0.018, "q3_p50_ms": 0.007, "q3_p99_ms": 0.011, "q4_p50_ms": 0.011, "q4_p99_ms": 0.325, "q5_p50_ms": 0.0239, "q5_p99_ms": 0.9247, "assert_ok": 1}, "status": "keep", "description": "segment-1 baseline: median-of-3 runner (AR_RUNS=3), unchanged code", "segment": 1, "timestamp": 1790150855}
{"run": 5, "commit": "4bf3204", "metric": 0.0108, "metrics": {"search_p99_ms": 0.5592, "q0_p50_ms": 0.0132, "q0_p99_ms": 0.0185, "q1_p50_ms": 0.0097, "q1_p99_ms": 0.3178, "q2_p50_ms": 0.0085, "q2_p99_ms": 0.0457, "q3_p50_ms": 0.0073, "q3_p99_ms": 0.0094, "q4_p50_ms": 0.0104, "q4_p99_ms": 0.2683, "q5_p50_ms": 0.0191, "q5_p99_ms": 0.74, "assert_ok": 1}, "status": "keep", "description": "batch pending access counts via Counter.update(ids) (C-speed replaces per-row dict loop) — -5.3% p50, -34% p99 vs segment-1 baseline", "segment": 1, "timestamp": 1790151047}
{"run": 6, "commit": "3535fcc", "metric": 0.0086, "metrics": {"search_p99_ms": 0.4658, "q0_p50_ms": 0.0074, "q0_p99_ms": 0.0096, "q1_p50_ms": 0.0092, "q1_p99_ms": 0.2475, "q2_p50_ms": 0.0084, "q2_p99_ms": 0.0126, "q3_p50_ms": 0.0065, "q3_p99_ms": 0.008, "q4_p50_ms": 0.0099, "q4_p99_ms": 0.1913, "q5_p50_ms": 0.0165, "q5_p99_ms": 0.5901, "assert_ok": 1}, "status": "keep", "description": "r.copy() instead of dict(r) at both recall return sites — -24.6% p50, -45% p99 vs segment-1 baseline", "segment": 1, "timestamp": 1790151489}
{"run": 7, "commit": "af2d969", "metric": 0.0081, "metrics": {"search_p99_ms": 0.4262, "q0_p50_ms": 0.0068, "q0_p99_ms": 0.0118, "q1_p50_ms": 0.0074, "q1_p99_ms": 0.2408, "q2_p50_ms": 0.0079, "q2_p99_ms": 0.01, "q3_p50_ms": 0.0069, "q3_p99_ms": 0.0081, "q4_p50_ms": 0.0091, "q4_p99_ms": 0.2268, "q5_p50_ms": 0.0093, "q5_p99_ms": 0.4815, "assert_ok": 1}, "status": "keep", "description": "pending = list of id-tuples (append per recall), per-id expansion only at flush; ACCESS_FLUSH_DISTINCT now bounds batches — -5.8% p50 (N=5 tiebreak), q5 -44%; checks.sh green", "segment": 1, "timestamp": 1790151640}
{"run": 8, "commit": "63a8366", "metric": 0.0096, "metrics": {"search_p99_ms": 0.7629, "q0_p50_ms": 0.0085, "q0_p99_ms": 0.0123, "q1_p50_ms": 0.0085, "q1_p99_ms": 0.3137, "q2_p50_ms": 0.0081, "q2_p99_ms": 0.0157, "q3_p50_ms": 0.0082, "q3_p99_ms": 0.0102, "q4_p50_ms": 0.0115, "q4_p99_ms": 0.2913, "q5_p50_ms": 0.0226, "q5_p99_ms": 0.9738, "assert_ok": 1}, "status": "discard", "description": "memo-hit micro-trims (isspace clamp, try/except _conn/_pending, eager ignored_changes/pending_hits) — 0.0096 vs 0.0081 best; q5 swung 2.4x suggesting machine-state noise; reverted, to be retried in a future session", "segment": 1, "timestamp": 1790196589}
{"type": "config", "name": "memory search speed (p50)", "metricName": "search_p50_ms", "metricUnit": "ms", "bestDirection": "lower"}
{"run": 9, "commit": "d1e20d0", "metric": 0.0108, "metrics": {"search_p99_ms": 0.6535, "q0_p50_ms": 0.0166, "q0_p99_ms": 0.0214, "q1_p50_ms": 0.011, "q1_p99_ms": 0.3074, "q2_p50_ms": 0.01, "q2_p99_ms": 0.0153, "q3_p50_ms": 0.0086, "q3_p99_ms": 0.0092, "q4_p50_ms": 0.0106, "q4_p99_ms": 0.2059, "q5_p50_ms": 0.0181, "q5_p99_ms": 0.9474, "assert_ok": 1}, "status": "keep", "description": "segment-2 baseline: quiet-machine probe on unchanged code (d1e20d0) \u2014 0.0108ms, +33% vs segment-1 best 0.0081 (machine drift, same signature as run 8); re-baseline before retrying the micro-trim bundle", "segment": 2, "timestamp": 1790198865}
{"run": 10, "commit": "b0f7c3a", "metric": 0.01, "metrics": {"search_p99_ms": 0.5895, "q0_p50_ms": 0.0118, "q0_p99_ms": 0.016, "q1_p50_ms": 0.0089, "q1_p99_ms": 0.2291, "q2_p50_ms": 0.0074, "q2_p99_ms": 0.011, "q3_p50_ms": 0.0079, "q3_p99_ms": 0.0091, "q4_p50_ms": 0.0107, "q4_p99_ms": 0.2113, "q5_p50_ms": 0.0146, "q5_p99_ms": 0.751, "assert_ok": 1}, "status": "keep", "description": "retry of run-8 memo-hit micro-trims (isspace no-alloc empty check, two-compare clamp, try/except _conn/_pending, eager-seeded ignored_changes/pending_hits direct reads) \u2014 0.0100 vs 0.0108 segment-2 baseline, -7.4% (N=5 tiebreak); every shape <= +1%, p99 -9.8%; checks.sh green (21+97)", "segment": 2, "timestamp": 1790199110}
{"run": 11, "commit": "4dbf2dc", "metric": 0.0051, "metrics": {"search_p99_ms": 0.3762, "q0_p50_ms": 0.0063, "q0_p99_ms": 0.0085, "q1_p50_ms": 0.0051, "q1_p99_ms": 0.0233, "q2_p50_ms": 0.0044, "q2_p99_ms": 0.0049, "q3_p50_ms": 0.0039, "q3_p99_ms": 0.0045, "q4_p50_ms": 0.0051, "q4_p99_ms": 0.0138, "q5_p50_ms": 0.0126, "q5_p99_ms": 0.5744, "assert_ok": 1}, "status": "keep", "description": "flush patches memoized rows in place (known per-id increments for access_count/last_accessed) instead of clearing _recall_cache \u2014 memo stays warm across flushes and one shape's flush no longer nukes other shapes' entries \u2014 0.0051 vs 0.0100 best, -49% (clear of band), p99 -36%, every shape improved; checks.sh green (21+97)", "segment": 2, "timestamp": 1790199447}
{"run": 12, "commit": "b46c882", "metric": 0.0073, "metrics": {"search_p99_ms": 0.4073, "q0_p50_ms": 0.0098, "q0_p99_ms": 0.0119, "q1_p50_ms": 0.008, "q1_p99_ms": 0.0423, "q2_p50_ms": 0.0047, "q2_p99_ms": 0.0088, "q3_p50_ms": 0.0043, "q3_p99_ms": 0.0069, "q4_p50_ms": 0.0056, "q4_p99_ms": 0.02, "q5_p50_ms": 0.0087, "q5_p99_ms": 0.4892, "assert_ok": 1}, "status": "discard", "description": "list(map(dict.copy, ...)) at both recall return sites \u2014 0.0073 vs 0.0051 best (+43%); q5 improved -31% exactly as microbench predicted while q0/q1 exploded +56% (shape-selective, micro-edits cannot do that = machine noise signature); reverted; q5 win corroborated, RETRY on a quiet machine", "segment": 2, "timestamp": 1790199804}
{"run": 13, "commit": "0af5ea4", "metric": 0.0087, "metrics": {"search_p99_ms": 0.6637, "q0_p50_ms": 0.0099, "q0_p99_ms": 0.0128, "q1_p50_ms": 0.0088, "q1_p99_ms": 0.0562, "q2_p50_ms": 0.0072, "q2_p99_ms": 0.0199, "q3_p50_ms": 0.0063, "q3_p99_ms": 0.0084, "q4_p50_ms": 0.0087, "q4_p99_ms": 0.0301, "q5_p50_ms": 0.0133, "q5_p99_ms": 0.743, "assert_ok": 1}, "status": "discard", "description": "quiet-machine probe on unchanged run-11 code \u2014 0.0087 vs 0.0051 best (+71%): noise CONFIRMED, q0/q1 match run-12's mid-run explosion. Root cause identified: stale foreign processes (spinning unittest PIDs 32516/3004 since 6:57AM, duplicate ai_sprink services, ~28% total CPU). No code change; awaiting noise-source resolution before next experiment", "segment": 2, "timestamp": 1790199964}
{"run": 14, "commit": "7cc4993", "metric": 0.0065, "metrics": {"search_p99_ms": 0.3935, "q0_p50_ms": 0.0067, "q0_p99_ms": 0.0106, "q1_p50_ms": 0.0052, "q1_p99_ms": 0.0292, "q2_p50_ms": 0.0066, "q2_p99_ms": 0.0088, "q3_p50_ms": 0.004, "q3_p99_ms": 0.0077, "q4_p50_ms": 0.0052, "q4_p99_ms": 0.0145, "q5_p50_ms": 0.0118, "q5_p99_ms": 0.6436, "assert_ok": 1}, "status": "discard", "description": "post-kill probe (unchanged code) \u2014 0.0065 vs 0.0051 (+27%): frozen_gate runaway tree eliminated (6 procs, self-nesting gates+unittests since 8:01, orphaned); recovery confirmed: q3/q1/q4/q0/q5 match run-11 quiet numbers, only q2 burst-hit during its window (0.0044->0.0066) dragging the aggregate; intermittent bursts remain (desktop apps) \u2014 proceed with N=5 tiebreaks", "segment": 2, "timestamp": 1790201270}
{"run": 15, "commit": "1bd961e", "metric": 0.0057, "metrics": {"search_p99_ms": 0.3463, "q0_p50_ms": 0.0061, "q0_p99_ms": 0.0076, "q1_p50_ms": 0.0055, "q1_p99_ms": 0.0301, "q2_p50_ms": 0.0047, "q2_p99_ms": 0.0057, "q3_p50_ms": 0.0044, "q3_p99_ms": 0.0059, "q4_p50_ms": 0.0058, "q4_p99_ms": 0.0214, "q5_p50_ms": 0.0086, "q5_p99_ms": 0.4246, "assert_ok": 1}, "status": "discard", "description": "map(dict.copy) retry on recovered machine \u2014 0.0057 vs 0.0051 (+11.8%, N=3 clear, no tiebreak). q5 -32% again (microbench corroborated twice, but above median), q0 roughly as predicted, q3's small real regression as predicted; q4 contradicted its -0.37us prediction (+0.7us = single-window burst). PARK the idea: aggregate p50 effect unresolvable under bursts; reverted", "segment": 2, "timestamp": 1790201399}
{"run": 16, "commit": "1bd961e", "metric": 0.0086, "metrics": {"search_p99_ms": 0.6298, "q0_p50_ms": 0.0098, "q0_p99_ms": 0.024, "q1_p50_ms": 0.0084, "q1_p99_ms": 0.0905, "q2_p50_ms": 0.0072, "q2_p99_ms": 0.0099, "q3_p50_ms": 0.0065, "q3_p99_ms": 0.0078, "q4_p50_ms": 0.0088, "q4_p99_ms": 0.0293, "q5_p50_ms": 0.0134, "q5_p99_ms": 0.8505, "assert_ok": 1}, "status": "discard", "description": "PRAGMA cursor reuse (cached version_cursor, -0.25us microbench) \u2014 0.0086 vs 0.0051 (+69%), uniformly elevated q0-q4 +56-73% = sustained-noise signature, NOT the code (removing an alloc cannot regress). Cause: frozen_gate tree RESPAWNED in fresh temp dir FK05R2 under live node PID 24108 (other session), CPU 96%. Reverted; idea deserves one retry when machine is usable", "segment": 2, "timestamp": 1790201533}
