{"run": 2, "commit": "a811d5b", "metric": 1.4245, "metrics": {"search_p50_ms": 0.7365, "search_p99_ms": 1.4245, "assert_ok": 1}, "status": "keep", "description": "Drop idx_memories_importance (DROPPED_INDEXES, self-applies to existing DBs). A/B: baseline p50~1.7/p99~3.7 -> patched p50~0.75/p99~1.4-1.7.", "timestamp": 1789546976702, "asi": {"hypothesis": "Bound LIKE param blinds planner to leading wildcard; it chose index-order scan (random I/O) + temp b-tree over sequential scan + sort. Confirmed via EXPLAIN QUERY PLAN lit-vs-bound 4x gap.", "lesson": "Discarded with evidence: FTS5 token-prefilter (unsound for infix LIKE), FTS5-trigram LIKE (slower, no acceleration), two-step narrow-sort fetch (+10% p99 but p50 worse + complexity), temp_store=MEMORY + 64MB cache (neutral-to-worse x3 runs).", "checks": "checks.sh: 21 contract OK, 57 passed/45 skipped", "next_action_hint": "Remaining floor is sequential LIKE scan; MCP hot path (namespaced, limit 10) already ~0.05ms via covering index. Further gains need semantic changes \u2014 out of scope."}}
{"type":"config","name":"memory search speed","metricName":"search_p99_ms","metricUnit":"ms","bestDirection":"higher"}
{"type":"config","name":"memory search speed","metricName":"search_p99_ms","metricUnit":"ms","bestDirection":"lower"}
{"run":109,"commit":"a447ef5","metric":3.6722,"metrics":{"assert_ok":1,"q0_p50_ms":0.1055,"q0_p99_ms":0.4897,"q1_p50_ms":1.4846,"q1_p99_ms":2.2834,"q2_p50_ms":1.5316,"q2_p99_ms":1.9637,"q3_p50_ms":1.4791,"q3_p99_ms":3.3738,"q4_p50_ms":0.1372,"q4_p99_ms":0.4496,"q5_p50_ms":1.8512,"q5_p99_ms":4.628,"search_p50_ms":1.3188},"status":"keep","description":"baseline: persistent-corpus benchmark + pinned python, search p99 reference","timestamp":1789548000133,"segment":6,"confidence":null,"asi":{"hypothesis":"infra baseline: persistent corpus DB + pinned python3.11 + builtins-only scripts; establishes reference after session-infra overhaul","noise_note":"Windows box jitter large: consecutive identical runs vary p99 by ~1ms; corpus build (cold cache) included in this run","probe_findings":"instr(lower(content),lower(?)) 2x SLOWER than LIKE (1.6-2.1 vs 0.7-1.0ms); dropping ESCAPE clause neutral; exec (scan+sort) dominates, fetch+todict minor","rollback_reason":"n/a baseline","next_action_hint":"try length(content) prefilter probe, then covering (importance,created_at) index with order-equivalence check"}}
{"type":"config","name":"memory search speed","metricName":"search_p50_ms","metricUnit":"ms","bestDirection":"lower"}
{"run":110,"commit":"02701f8","metric":0.716,"metrics":{"assert_ok":1,"q0_p50_ms":0.0421,"q0_p99_ms":0.0637,"q1_p50_ms":0.7509,"q1_p99_ms":1.4159,"q2_p50_ms":1.142,"q2_p99_ms":1.4209,"q3_p50_ms":0.7081,"q3_p99_ms":1.0841,"q4_p50_ms":0.0942,"q4_p99_ms":0.1694,"q5_p50_ms":0.9994,"q5_p99_ms":2.0398,"search_p99_ms":1.9347},"status":"keep","description":"baseline: p50 primary, search p50 reference","timestamp":1789548100489,"segment":7,"confidence":null,"asi":{"hypothesis":"re-baseline after estimator change: primary now p50 (robust on this box), REPS=60, gc hygiene, persistent corpus","noise_note":"p99 still secondary; p50 repeats within ~12%","next_action_hint":"experiment 1: length(content) prefilter probe then implement if wins"}}
{"run":111,"commit":"d130670","metric":0.5918,"metrics":{"assert_ok":1,"q0_p50_ms":0.0423,"q0_p99_ms":0.0446,"q1_p50_ms":0.6915,"q1_p99_ms":1.2747,"q2_p50_ms":0.835,"q2_p99_ms":1.3765,"q3_p50_ms":0.6205,"q3_p99_ms":1.1134,"q4_p50_ms":0.0583,"q4_p99_ms":0.1643,"q5_p50_ms":0.1214,"q5_p99_ms":0.503,"search_p99_ms":1.2852},"status":"keep","description":"add covering rank index for unfiltered recall (no sort, LIMIT early exit)","timestamp":1789548255741,"segment":7,"confidence":null,"asi":{"hypothesis":"covering rank index (importance DESC, created_at DESC, content, namespace) lets unfiltered recall stream in order with no temp sort and LIMIT early-exit","narrow_variant_rollback":"rank-only index without content made rare/phrase/miss 1.5x worse via per-row table fetches; covering fixes that","order_proof":"zero (importance,created_at) tie groups in corpus + full ID-sequence identical old-vs-new plan on all 6 shapes","remember_cost":"+12us/op (0.094->0.106ms, worst case, cache favored second run); second content-sized index on disk","rerun_confirm":"first run 0.6594 (q3 1.18 noise spike), confirm 0.5918; both beat 0.716 baseline","next_action_hint":"remaining scan floor ~0.6-0.7ms is LIKE evals over 3000 rows; consider per-row predicate cost (ESCAPE branch) or accepting ceiling"}}
{"run":112,"commit":"09e6619","metric":0.5387,"metrics":{"assert_ok":1,"q0_p50_ms":0.0454,"q0_p99_ms":0.0494,"q1_p50_ms":0.6118,"q1_p99_ms":1.1411,"q2_p50_ms":0.6745,"q2_p99_ms":1.2437,"q3_p50_ms":0.5654,"q3_p99_ms":1.0624,"q4_p50_ms":0.0631,"q4_p99_ms":0.105,"q5_p50_ms":0.139,"q5_p99_ms":0.5479,"search_p99_ms":1.2244},"status":"keep","description":"search content_lower with instr() instead of content with LIKE (ASCII-folded copy, keeps results identical)","timestamp":1789548753347,"segment":7,"confidence":3.3389830508474554,"asi":{"ab_comparison":"clean interleaved A/B on frozen corpora: instr 1.24x (rare) / 1.39x (phrase) / 1.65x (no-match) vs LIKE; namespaced + wide shapes neutral; result ids identical on all 6 shapes","guard_probe_discarded":"NULL-safe OR-fallback predicate (row-robust against mixed-version writers) cost 1.17-1.25x on scan-bound queries because it forces a table fetch; replaced with a migration-time backfill probed via a partial index (O(1) when clean)","migration":"ALTER TABLE ADD COLUMN + backfill lower(content) once; index DDL is now compared against sqlite_master and rebuilt only when the column list changed (IF NOT EXISTS matches name only)","regression_tests":"tests/test_python_hardening.py: LIKE-vs-instr equivalence incl. non-ASCII case sensitivity + %/_/backslash literals; stale-row backfill on reopen","semantics":"SQLite lower() and LIKE are both ASCII-only case folding; instr takes the pattern literally, so the old ESCAPE/%/_ dance is gone","hypothesis":"search an ASCII-lowered copy with instr() instead of content with LIKE: LIKE's case-insensitive matcher costs ~1.3-1.8x a plain substring scan per row, and for rare/phrase/no-match shapes that per-row cost is the entire query cost"}}
